{
  "id": "43830dfc-aca5-422e-b6ee-3d1c65a8dfa5",
  "empresa": {
    "nombre": "Prueba 1",
    "rubro": "Industria Forestal",
    "mercadosObjetivo": [
      "Brasil"
    ],
    "perfil": "no_exporta_evalua_iniciar",
    "relevadoPor": "Equipo 1",
    "fecha": "2026-10-27",
    "autorizaRecontacto": false
  },
  "respuestas": [
    {
      "itemId": "IA1",
      "situacion": 3,
      "impacto": 2,
      "observacion": ""
    },
    {
      "itemId": "IA2",
      "situacion": 3,
      "impacto": 2,
      "observacion": ""
    },
    {
      "itemId": "IA3",
      "situacion": 3,
      "impacto": 3,
      "observacion": ""
    },
    {
      "itemId": "IA4",
      "situacion": 2,
      "impacto": 2,
      "observacion": ""
    },
    {
      "itemId": "IA5",
      "situacion": 2,
      "impacto": 3,
      "observacion": ""
    },
    {
      "itemId": "IB1",
      "situacion": 2,
      "impacto": 3,
      "observacion": ""
    },
    {
      "itemId": "IB2",
      "situacion": 3,
      "impacto": 2,
      "observacion": ""
    },
    {
      "itemId": "IB3",
      "situacion": 2,
      "impacto": 2,
      "observacion": ""
    },
    {
      "itemId": "IB4",
      "situacion": 4,
      "impacto": 2,
      "observacion": ""
    },
    {
      "itemId": "IB5",
      "situacion": 4,
      "impacto": 3,
      "observacion": ""
    },
    {
      "itemId": "IB6",
      "situacion": 2,
      "impacto": 2,
      "observacion": ""
    },
    {
      "itemId": "IB7",
      "situacion": 1,
      "impacto": 2,
      "observacion": ""
    },
    {
      "itemId": "IC1",
      "situacion": 3,
      "impacto": 3,
      "observacion": ""
    },
    {
      "itemId": "IC2",
      "situacion": 1,
      "impacto": 3,
      "observacion": ""
    },
    {
      "itemId": "IC3",
      "situacion": 1,
      "impacto": 2,
      "observacion": ""
    },
    {
      "itemId": "IC4",
      "situacion": 1,
      "impacto": 2,
      "observacion": ""
    },
    {
      "itemId": "IC5",
      "situacion": 1,
      "impacto": 3,
      "observacion": ""
    },
    {
      "itemId": "ID1",
      "situacion": 3,
      "impacto": 3,
      "observacion": ""
    },
    {
      "itemId": "ID2",
      "situacion": 2,
      "impacto": 3,
      "observacion": ""
    },
    {
      "itemId": "ID3",
      "situacion": 3,
      "impacto": 2,
      "observacion": ""
    },
    {
      "itemId": "ID4",
      "situacion": 1,
      "impacto": 2,
      "observacion": ""
    },
    {
      "itemId": "ID5",
      "situacion": 2,
      "impacto": 2,
      "observacion": ""
    },
    {
      "itemId": "IE1",
      "situacion": 3,
      "impacto": 3,
      "observacion": ""
    },
    {
      "itemId": "IE2",
      "situacion": 3,
      "impacto": 2,
      "observacion": ""
    },
    {
      "itemId": "IE3",
      "situacion": 0,
      "impacto": 2,
      "observacion": ""
    },
    {
      "itemId": "IE4",
      "situacion": 3,
      "impacto": 2,
      "observacion": ""
    },
    {
      "itemId": "IE5",
      "situacion": 3,
      "impacto": 2,
      "observacion": ""
    },
    {
      "itemId": "IE6",
      "situacion": 2,
      "impacto": 0,
      "observacion": ""
    },
    {
      "itemId": "IF1",
      "situacion": 3,
      "impacto": 0,
      "observacion": ""
    },
    {
      "itemId": "IF2",
      "situacion": 3,
      "impacto": 3,
      "observacion": ""
    },
    {
      "itemId": "IF3",
      "situacion": 3,
      "impacto": 2,
      "observacion": ""
    },
    {
      "itemId": "IF4",
      "situacion": 2,
      "impacto": 2,
      "observacion": ""
    },
    {
      "itemId": "IF5",
      "situacion": 2,
      "impacto": 3,
      "observacion": ""
    },
    {
      "itemId": "IF6",
      "situacion": 3,
      "impacto": 3,
      "observacion": ""
    },
    {
      "itemId": "IF7",
      "situacion": 2,
      "impacto": 3,
      "observacion": ""
    },
    {
      "itemId": "IF8",
      "situacion": 3,
      "impacto": 3,
      "observacion": ""
    },
    {
      "itemId": "IG1",
      "situacion": 2,
      "impacto": 3,
      "observacion": ""
    },
    {
      "itemId": "IG2",
      "situacion": 3,
      "impacto": 2,
      "observacion": ""
    },
    {
      "itemId": "IG3",
      "situacion": 3,
      "impacto": 2,
      "observacion": ""
    },
    {
      "itemId": "IG4",
      "situacion": 2,
      "impacto": 3,
      "observacion": ""
    },
    {
      "itemId": "IG5",
      "situacion": 2,
      "impacto": 2,
      "observacion": ""
    },
    {
      "itemId": "IG6",
      "situacion": 3,
      "impacto": 0,
      "observacion": ""
    },
    {
      "itemId": "IG7",
      "situacion": 2,
      "impacto": 2,
      "observacion": ""
    },
    {
      "itemId": "IG8",
      "situacion": 2,
      "impacto": 2,
      "observacion": ""
    },
    {
      "itemId": "IG9",
      "situacion": 1,
      "impacto": 2,
      "observacion": ""
    },
    {
      "itemId": "IH1",
      "situacion": 3,
      "impacto": 2,
      "observacion": ""
    },
    {
      "itemId": "IH2",
      "situacion": 1,
      "impacto": 3,
      "observacion": ""
    },
    {
      "itemId": "IH3",
      "situacion": 2,
      "impacto": 2,
      "observacion": ""
    },
    {
      "itemId": "IH4",
      "situacion": 4,
      "impacto": 2,
      "observacion": ""
    },
    {
      "itemId": "IH5",
      "situacion": 1,
      "impacto": 3,
      "observacion": ""
    },
    {
      "itemId": "IH6",
      "situacion": 4,
      "impacto": 3,
      "observacion": ""
    },
    {
      "itemId": "II1",
      "situacion": 3,
      "impacto": 2,
      "observacion": ""
    },
    {
      "itemId": "II2",
      "situacion": 0,
      "impacto": 3,
      "observacion": ""
    },
    {
      "itemId": "II3",
      "situacion": 3,
      "impacto": 3,
      "observacion": ""
    },
    {
      "itemId": "II4",
      "situacion": 2,
      "impacto": 2,
      "observacion": ""
    },
    {
      "itemId": "II5",
      "situacion": 2,
      "impacto": 2,
      "observacion": ""
    },
    {
      "itemId": "II6",
      "situacion": 4,
      "impacto": 2,
      "observacion": ""
    },
    {
      "itemId": "IJ1",
      "situacion": 2,
      "impacto": 2,
      "observacion": ""
    },
    {
      "itemId": "IJ2",
      "situacion": 1,
      "impacto": 2,
      "observacion": ""
    },
    {
      "itemId": "IJ3",
      "situacion": 1,
      "impacto": 3,
      "observacion": ""
    },
    {
      "itemId": "IJ4",
      "situacion": 3,
      "impacto": 2,
      "observacion": ""
    },
    {
      "itemId": "IJ5",
      "situacion": 2,
      "impacto": 2,
      "observacion": ""
    },
    {
      "itemId": "IJ6",
      "situacion": 1,
      "impacto": 3,
      "observacion": ""
    },
    {
      "itemId": "IJ7",
      "situacion": 0,
      "impacto": 2,
      "observacion": ""
    },
    {
      "itemId": "EA1",
      "situacion": 2,
      "impacto": 2,
      "observacion": ""
    },
    {
      "itemId": "EA2",
      "situacion": 2,
      "impacto": 3,
      "observacion": ""
    },
    {
      "itemId": "EA3",
      "situacion": 3,
      "impacto": 3,
      "observacion": ""
    },
    {
      "itemId": "EA4",
      "situacion": 1,
      "impacto": 1,
      "observacion": ""
    },
    {
      "itemId": "EA5",
      "situacion": 2,
      "impacto": 3,
      "observacion": ""
    },
    {
      "itemId": "EA6",
      "situacion": 3,
      "impacto": 3,
      "observacion": ""
    },
    {
      "itemId": "EB1",
      "situacion": 1,
      "impacto": 3,
      "observacion": ""
    },
    {
      "itemId": "EB2",
      "situacion": 2,
      "impacto": 3,
      "observacion": ""
    },
    {
      "itemId": "EB3",
      "situacion": 2,
      "impacto": 2,
      "observacion": ""
    },
    {
      "itemId": "EB4",
      "situacion": 2,
      "impacto": 2,
      "observacion": ""
    },
    {
      "itemId": "EB5",
      "situacion": 2,
      "impacto": 2,
      "observacion": ""
    },
    {
      "itemId": "EB6",
      "situacion": 1,
      "impacto": 1,
      "observacion": ""
    },
    {
      "itemId": "EB7",
      "situacion": 3,
      "impacto": 1,
      "observacion": ""
    },
    {
      "itemId": "EB8",
      "situacion": 3,
      "impacto": 2,
      "observacion": ""
    },
    {
      "itemId": "EC1",
      "situacion": 2,
      "impacto": 3,
      "observacion": ""
    },
    {
      "itemId": "EC2",
      "situacion": 4,
      "impacto": 2,
      "observacion": ""
    },
    {
      "itemId": "EC3",
      "situacion": 1,
      "impacto": 2,
      "observacion": ""
    },
    {
      "itemId": "EC4",
      "situacion": 3,
      "impacto": 2,
      "observacion": ""
    },
    {
      "itemId": "EC5",
      "situacion": 4,
      "impacto": 3,
      "observacion": ""
    },
    {
      "itemId": "ED1",
      "situacion": 2,
      "impacto": 1,
      "observacion": ""
    },
    {
      "itemId": "ED2",
      "situacion": 1,
      "impacto": 2,
      "observacion": ""
    },
    {
      "itemId": "ED3",
      "situacion": 2,
      "impacto": 2,
      "observacion": ""
    },
    {
      "itemId": "ED4",
      "situacion": 2,
      "impacto": 2,
      "observacion": ""
    },
    {
      "itemId": "EE1",
      "situacion": 2,
      "impacto": 1,
      "observacion": ""
    },
    {
      "itemId": "EE2",
      "situacion": 2,
      "impacto": 2,
      "observacion": ""
    },
    {
      "itemId": "EE3",
      "situacion": 2,
      "impacto": 3,
      "observacion": ""
    },
    {
      "itemId": "EE4",
      "situacion": 1,
      "impacto": 1,
      "observacion": ""
    },
    {
      "itemId": "EE5",
      "situacion": 2,
      "impacto": 3,
      "observacion": ""
    },
    {
      "itemId": "EE6",
      "situacion": 2,
      "impacto": 2,
      "observacion": ""
    },
    {
      "itemId": "EE7",
      "situacion": 2,
      "impacto": 3,
      "observacion": ""
    },
    {
      "itemId": "EF1",
      "situacion": 1,
      "impacto": 2,